<!DOCTYPE NEWSPAPER [
	<!ELEMENT NEWSPAPER(ARTICLE+)>
	<!ELEMENT ARTICLE(HEADLINE, BODY, NOTES)>
	<!ELEMENT HEADLINE(#PCDATA)>
	<!ELEMENT BODY(#PCDATA)>
	<!ELEMENT NOTES(#PCDATA)>
	<!ATTLIST ARTICLE AUTHOR CDATA #REQUIRED>
	<!ATTLIST ARTICLE EDITOR CDATA #IMPLIED>
	]>